{
  "id": "conversational-phone-agent-with-natural-interruptions",
  "slug": "conversational-phone-agent-with-natural-interruptions",
  "title": "Conversational Phone Agent with Natural Interruptions",
  "description": "A voice agent that handles inbound and outbound phone calls with natural conversation flow, supporting user interruptions and multi-turn dialogue. Uses streaming speech recognition and text-to-speech for low-latency responses over standard telephone lines.",
  "framework": "Pipecat",
  "use_case": "support",
  "industry": "other",
  "languages": [
    "en-US"
  ],
  "pipeline": {
    "stt": "Deepgram Nova-3",
    "llm": "GPT-4o-mini",
    "tts": "OpenAI gpt-4o-mini-tts",
    "telephony": "Plivo"
  },
  "metrics": {
    "latency_display": "Real-time streaming with built-in VAD",
    "cost_display": "Low cost per minute (GPT-4o-mini + Deepgram + OpenAI TTS)"
  },
  "raw_prompt": null,
  "prompt_file": null,
  "config": {
    "tts_voice": "alloy",
    "sample_rate": 8000,
    "vad_enabled": true,
    "audio_format": "mulaw",
    "add_wav_header": false,
    "available_voices": [
      "alloy",
      "ash",
      "ballad",
      "coral",
      "echo",
      "fable",
      "nova",
      "onyx",
      "sage",
      "shimmer",
      "verse"
    ],
    "allow_interruptions": true,
    "vad_audio_passthrough": true
  },
  "github_source_url": "https://github.com/plivo/python-agents-examples/tree/main/gpt4o-deepgramnova3-openaitts4o-pipecat",
  "demo_url": null,
  "tags": [
    "pipecat",
    "streaming",
    "barge-in",
    "inbound",
    "outbound",
    "telephony"
  ],
  "contributor": {
    "github": "plivo"
  },
  "source": "github_discovery",
  "created_at": "2025-05-27T10:30:00+00:00",
  "updated_at": "2025-05-27T10:30:00+00:00",
  "license": "Proprietary"
}
