{
  "id": "vapi-instawork-screening",
  "slug": "vapi-instawork-screening",
  "title": "Candidate Screening Interviewer",
  "description": "Outbound voice agent that conducts a structured candidate phone-screen for an hourly-labor marketplace: confirms identity, runs role-specific skill questions, captures structured answers, and approves or rejects the candidate downstream.",
  "framework": "Vapi",
  "use_case": "research-interview",
  "industry": "saas",
  "languages": ["en-US"],
  "pipeline": {
    "stt": "Deepgram Nova-3",
    "llm": "Claude Sonnet 4.5",
    "tts": "Cartesia Sonic-3",
    "telephony": "Twilio Voice"
  },
  "metrics": {
    "latency_p50_ms": 465,
    "latency_p95_ms": 1000,
    "latency_display": "~465-1000ms",
    "cost_per_minute_usd_min": 0.14,
    "cost_per_minute_usd_max": 0.23,
    "cost_display": "$0.14 - $0.23"
  },
  "prompt_file": "prompts/vapi-instawork-screening.md",
  "config": {
    "voice_id": null,
    "temperature": 0.3,
    "barge_in": true,
    "interruption_threshold_ms": null,
    "tools": [
      { "name": "lookup_position", "description": "Get the role description and required skill questions" },
      { "name": "record_answer", "description": "Save a structured answer with score" },
      { "name": "approve_for_position", "description": "Submit final approve/reject + structured rubric scores" },
      { "name": "transfer_to_recruiter", "description": "Warm transfer for edge cases" }
    ]
  },
  "github_source_url": "https://vapi.ai/blog/case-study-instawork",
  "demo_url": "https://vapi.ai/blog/case-study-instawork",
  "tags": ["staffing", "screening", "interview", "vapi", "structured-output"],
  "contributor": {
    "github": "speechstack",
    "twitter": "speechstack",
    "name": "Speechstack Team",
    "website": "https://speechstack.com"
  },
  "source": "vendor_showcase",
  "verified": false,
  "featured": false,
  "created_at": "2026-05-16T00:00:00Z",
  "updated_at": "2026-05-18T00:00:00Z",
  "license": "Proprietary",
  "notes": "Instawork's exact stack is not publicly disclosed; pipeline reflects Vapi's documented 'flexible model configuration' defaults. Latency P50 anchored on Telnyx's benchmark of Vapi at '~465ms end-to-end in optimal configurations'. Vapi explicitly cited structured outputs and forward-deployed engineering as Instawork's reasons for choosing them over ElevenLabs and LiveKit."
}
