{
  "id": "whatsapp-voice-conversational-agent",
  "slug": "whatsapp-voice-conversational-agent",
  "title": "WhatsApp Voice Conversational Agent",
  "description": "A voice-based conversational agent that integrates with WhatsApp Business API to handle voice calls over WebRTC. Demonstrates how to build a bot that automatically answers WhatsApp voice calls and conducts natural conversations using Gemini and Pipecat's SmallWebRTC transport.",
  "framework": "Pipecat",
  "use_case": "support",
  "industry": "other",
  "languages": [
    "en-US"
  ],
  "pipeline": {
    "stt": "Deepgram Nova-2",
    "llm": "Gemini 2.5 Flash",
    "tts": "Cartesia Sonic-2",
    "telephony": "Web Only"
  },
  "raw_prompt": null,
  "prompt_file": null,
  "config": {
    "transport": "SmallWebRTCTransport",
    "webhook_path": "/whatsapp",
    "whatsapp_integration": true
  },
  "github_source_url": "https://github.com/daily-co/pcc-gemini-whatsapp",
  "demo_url": null,
  "tags": [
    "whatsapp",
    "webrtc",
    "messaging",
    "voice-call",
    "business-api"
  ],
  "contributor": {
    "github": "filipi87"
  },
  "source": "github_discovery",
  "created_at": "2025-05-28T19:30:00+00:00",
  "updated_at": "2025-05-28T19:30:00+00:00",
  "license": "Proprietary"
}
