{
  "id": "voice-agent-with-visual-data-verification-for-lead-capture",
  "slug": "voice-agent-with-visual-data-verification-for-lead-capture",
  "title": "Voice Agent with Visual Data Verification for Lead Capture",
  "description": "A voice-first AI receptionist that captures user information through natural conversation and ensures 100% data accuracy through a unique human-in-the-loop verification workflow. Users visually confirm all captured information in a form before submission, eliminating transcription errors and ensuring structured data reliability for CRM integration, appointment booking, and lead qualification.",
  "framework": "LiveKit Agents",
  "use_case": "lead-qualification",
  "industry": "other",
  "languages": [
    "en-US"
  ],
  "pipeline": {
    "stt": "Deepgram Nova-2",
    "llm": "Groq Llama 3.3 70B",
    "tts": "Cartesia Sonic-3",
    "telephony": "Web Only"
  },
  "raw_prompt": null,
  "prompt_file": null,
  "config": {
    "tools": [
      {
        "name": "data_capture",
        "description": "Captures structured user information during conversation for visual verification"
      },
      {
        "name": "form_verification",
        "description": "Presents captured data to user in a form for visual confirmation before submission"
      }
    ],
    "personality": "configurable",
    "knowledge_base": "configurable",
    "verification_workflow": "RPC-driven visual form verification"
  },
  "github_source_url": "https://github.com/jeffo777/input-right",
  "demo_url": "https://www.youtube.com/watch?v=unc9YS0cvdg",
  "tags": [
    "data-verification",
    "lead-capture",
    "human-in-the-loop",
    "form-filling",
    "receptionist",
    "open-source"
  ],
  "contributor": {
    "github": "jeffo777"
  },
  "source": "github_discovery",
  "created_at": "2025-05-30T18:45:00Z",
  "updated_at": "2025-05-30T18:45:00Z",
  "license": "Apache-2.0"
}
