{
  "id": "elder-care-advisor-for-adult-children",
  "slug": "elder-care-advisor-for-adult-children",
  "title": "Elder Care Advisor for Adult Children",
  "description": "An empathy-tuned voice agent that helps adult children explore elder care options for their parents. The agent conducts a conversational assessment covering mobility, health conditions, and care urgency, then provides personalized recommendations and schedules follow-up callbacks. Features a talking-head avatar with real-time lip-sync and structured care summaries.",
  "framework": "Pipecat",
  "use_case": "lead-qualification",
  "industry": "healthcare",
  "languages": [
    "en-US"
  ],
  "pipeline": {
    "stt": "Deepgram Nova-3",
    "llm": "Claude Sonnet 4.5",
    "tts": "Cartesia Sonic-2",
    "telephony": "Web Only"
  },
  "raw_prompt": null,
  "prompt_file": null,
  "config": {
    "voice_id": "Joseph",
    "tools": [
      {
        "name": "assess_risk",
        "description": "Records urgency level and risk factors based on the conversation"
      },
      {
        "name": "create_care_plan",
        "description": "Generates personalized care recommendations"
      },
      {
        "name": "schedule_callback",
        "description": "Books a follow-up call with the caller"
      },
      {
        "name": "end_call_gracefully",
        "description": "Allows the agent to end the call after meaningful work is completed"
      }
    ],
    "avatar": "Tavus Phoenix-4",
    "features": [
      "voice_cloning",
      "real_time_transcript",
      "conversation_persistence",
      "tool_call_audit_trail"
    ],
    "transport": "Daily WebRTC"
  },
  "github_source_url": "https://github.com/flaminshinjan/emoha-poc",
  "demo_url": "https://github.com/flaminshinjan/emoha-poc",
  "tags": [
    "elder-care",
    "healthcare-navigation",
    "empathy-driven",
    "avatar",
    "voice-cloning",
    "care-assessment"
  ],
  "contributor": {
    "github": "flaminshinjan"
  },
  "source": "github_discovery",
  "created_at": "2026-01-20T00:00:00Z",
  "updated_at": "2026-01-20T00:00:00Z",
  "license": "Proprietary"
}
