{
  "id": "telephony-voice-agent-with-inbound-and-outbound-call-handling",
  "slug": "telephony-voice-agent-with-inbound-and-outbound-call-handling",
  "title": "Telephony voice agent with inbound and outbound call handling",
  "description": "A minimal bridge connecting Twilio Programmable Voice to the AssemblyAI Voice Agent API. Handles both inbound and outbound phone calls with zero audio transcoding by using G.711 μ-law passthrough. Includes tool calling example (generate random number) and automatic barge-in support. Demonstrates how to build a telephony voice agent that answers calls, speaks first on outbound dials, and executes function calls.",
  "framework": "Custom",
  "use_case": "support",
  "industry": "telecom",
  "languages": [
    "en-US"
  ],
  "pipeline": {
    "stt": "AssemblyAI Streaming",
    "llm": "GPT-4o",
    "tts": "ElevenLabs Turbo v2.5",
    "telephony": "Twilio Voice"
  },
  "raw_prompt": null,
  "prompt_file": null,
  "config": {
    "voice_id": "ivy",
    "barge_in": true,
    "tools": [
      {
        "name": "generate_random_number",
        "description": "Generates a random number as a sample tool call"
      }
    ],
    "audio_format": "audio/pcmu",
    "sample_rate_hz": 8000
  },
  "github_source_url": "https://github.com/AssemblyAI/voice-agent-api-twilio-example",
  "demo_url": null,
  "tags": [
    "telephony",
    "twilio",
    "inbound",
    "outbound",
    "tool-calling",
    "g711-mulaw",
    "zero-transcoding"
  ],
  "contributor": {
    "github": "dan-ince-aai"
  },
  "source": "github_discovery",
  "created_at": "2026-05-19T18:30:00Z",
  "updated_at": "2026-05-19T18:30:00Z",
  "license": "Proprietary"
}
