{
  "id": "multi-agent-voice-framework-for-customer-service-and-chat-supervision",
  "slug": "multi-agent-voice-framework-for-customer-service-and-chat-supervision",
  "title": "Multi Agent Voice Framework for Customer Service and Chat Supervision",
  "description": "A demonstration framework for building advanced voice AI agents using OpenAI's Realtime API and Agents SDK. Features two core patterns: chat-supervisor (where a voice agent delegates complex tasks to a text-based supervisor model) and sequential handoffs (where specialized agents transfer users between them). Includes examples for customer service, authentication, returns processing, and sales with state machine prompting and output guardrails.",
  "framework": "Custom",
  "use_case": "support",
  "industry": "other",
  "languages": [
    "en-US"
  ],
  "pipeline": {
    "stt": "OpenAI Whisper",
    "llm": "GPT-4o",
    "tts": "OpenAI TTS-1",
    "telephony": "Web Only"
  },
  "raw_prompt": null,
  "prompt_file": null,
  "config": {
    "agents": [
      "authentication",
      "returns",
      "sales",
      "simulatedHuman",
      "greeter",
      "haikuWriter"
    ],
    "features": [
      "multi_agent_orchestration",
      "tool_calling",
      "state_machine_prompting",
      "output_guardrails",
      "agent_handoffs"
    ],
    "patterns": [
      "chat-supervisor",
      "sequential-handoffs"
    ],
    "chat_model": "gpt-4o-realtime-mini",
    "push_to_talk": true,
    "escalation_model": "o4-mini",
    "supervisor_model": "gpt-4.1",
    "voice_activity_detection": true
  },
  "github_source_url": "https://github.com/openai/openai-realtime-agents",
  "demo_url": null,
  "tags": [
    "multi-agent",
    "customer-service",
    "agent-handoffs",
    "chat-supervisor",
    "state-machine",
    "guardrails",
    "typescript",
    "nextjs",
    "openai-agents-sdk",
    "realtime-api"
  ],
  "contributor": {
    "github": "openai"
  },
  "source": "github_discovery",
  "created_at": "2025-05-26T12:00:00-07:00",
  "updated_at": "2025-05-26T12:00:00-07:00",
  "license": "MIT"
}
