{
  "id": "general-purpose-voice-agent-with-open-source-nvidia-models",
  "slug": "general-purpose-voice-agent-with-open-source-nvidia-models",
  "title": "General Purpose Voice Agent with Open Source NVIDIA Models",
  "description": "A low-latency voice agent implementation using NVIDIA's open source models (Nemotron Speech ASR, Nemotron-3 Nano LLM, and Magpie TTS). Features adaptive TTS streaming, buffered LLM with 100% KV cache reuse, and multiple deployment options including local GPU execution on DGX Spark/RTX 5090 or cloud deployment via Modal and Pipecat Cloud.",
  "framework": "Pipecat",
  "use_case": "other",
  "industry": "other",
  "languages": [
    "en-US"
  ],
  "pipeline": {
    "stt": "Deepgram Nova-3",
    "llm": "Llama 3.3 70B",
    "tts": "Cartesia Sonic-3",
    "telephony": "Web Only"
  },
  "metrics": {
    "latency_p50_ms": null,
    "latency_p95_ms": null,
    "latency_display": "Optimized for voice-to-voice latency with buffered LLM and adaptive TTS",
    "cost_per_minute_usd_min": null,
    "cost_per_minute_usd_max": null,
    "cost_display": "Self-hosted on NVIDIA GPU hardware (DGX Spark or RTX 5090)"
  },
  "raw_prompt": null,
  "prompt_file": null,
  "config": {
    "llm_mode": "llamacpp-q8",
    "vad_type": "SmartTurn",
    "adaptive_tts": true,
    "context_size": 16384,
    "kv_cache_reuse": "100%",
    "parallel_slots": 1,
    "recording_enabled": false,
    "transport_options": [
      "webrtc",
      "daily",
      "twilio"
    ],
    "deployment_targets": [
      "local-dgx-spark",
      "local-rtx-5090",
      "modal-cloud",
      "pipecat-cloud"
    ],
    "single_slot_operation": true
  },
  "github_source_url": "https://github.com/pipecat-ai/nemotron-january-2026",
  "demo_url": "https://www.youtube.com/watch?v=8Fkz2PC54BI",
  "tags": [
    "nvidia",
    "open-source",
    "low-latency",
    "self-hosted",
    "gpu",
    "dgx-spark",
    "rtx-5090",
    "websocket",
    "adaptive-streaming",
    "kv-cache"
  ],
  "contributor": {
    "github": "kwindla"
  },
  "source": "github_discovery",
  "created_at": "2025-06-01T12:00:00-07:00",
  "updated_at": "2025-06-01T12:00:00-07:00",
  "license": "Proprietary"
}
