{
  "id": "healthcare-prescription-savings-outreach-agent",
  "slug": "healthcare-prescription-savings-outreach-agent",
  "title": "Healthcare Prescription Savings Outreach Agent",
  "description": "A voice agent that conducts outbound calls to patients about prescription savings programs, comparing current medications with recommended alternatives. The agent greets patients by name, discusses their medication records, and provides personalized information about cost-saving opportunities through natural conversation.",
  "framework": "Custom",
  "use_case": "outbound-follow-up",
  "industry": "healthcare",
  "languages": [
    "en-US"
  ],
  "pipeline": {
    "stt": "Deepgram Nova-3",
    "llm": "Claude Haiku 4.5",
    "tts": "Deepgram Aura-2",
    "telephony": "Web Only"
  },
  "raw_prompt": null,
  "prompt_file": null,
  "config": {
    "barge_in": true,
    "data_source": "patient_promotions_dataset.jsonl",
    "architecture": "websockets_asyncio",
    "stt_encoding": "pcm",
    "tts_encoding": "pcm",
    "bedrock_model": "us.anthropic.claude-haiku-4-5-20251001-v1:0",
    "turn_detection": "built-in",
    "stt_sample_rate": 16000,
    "tts_sample_rate": 24000,
    "sagemaker_deployment": true,
    "greeting_pregenerated": true,
    "deepgram_sagemaker_version": "0.2.2"
  },
  "github_source_url": "https://github.com/deepgram/deepgram-patient-connect",
  "demo_url": null,
  "tags": [
    "healthcare",
    "prescription",
    "outbound",
    "sagemaker",
    "bedrock",
    "aws",
    "patient-outreach",
    "medication-management"
  ],
  "contributor": {
    "github": "jeniya-tabassum"
  },
  "source": "github_discovery",
  "created_at": "2025-01-10T19:30:00Z",
  "updated_at": "2025-01-10T19:30:00Z",
  "license": "Proprietary"
}
